category,welfareType,servId,servNm,region,agency,department,intrsThemaArray,lifeArray,srvPvsnNm,sprtCycNm,servDgst,servDtlLink,inqNum,contact
제도,지자체,WLF00002318,다문화가족지원,경상북도,경상북도,경상북도 안동시 복지환경국 여성가족과,"서민금융, 교육, 임신·출산","노년, 영유아, 아동, 임신 · 출산, 청소년, 중장년, 청년","현금지급, 프로그램/서비스(서비스)",년,다문화가족이 지역사회에서 안정적으로 정착하고 행복한 가정생활을 영위하여 자립기반을 조성할 수 있도록 다양한 지원 및 사업 실시,https://www.bokjiro.go.kr/ssis-tbu/twataa/wlfareInfo/moveTWAT52011M.do?wlfareInfoId=WLF00002318&wlfareInfoReldBztpCd=02,1976,
제도,지자체,WLF00002760,장애인 의료재활지원,세종특별자치시,세종특별자치시,세종특별자치시 보건복지국 노인장애인과,서민금융,"노년, 중장년, 아동, 영유아, 청년, 청소년",현금지급,1회성,저소득 장루 요루 장애인에 대한 의료케어제품 구입비 지원,https://www.bokjiro.go.kr/ssis-tbu/twataa/wlfareInfo/moveTWAT52011M.do?wlfareInfoId=WLF00002760&wlfareInfoReldBztpCd=02,1406,
제도,지자체,WLF00000434,가정위탁아동 지원,경상남도,경상남도,경상남도 사천시 행정복지국 여성가족과,"안전·위기, 서민금융, 입양·위탁","청소년, 영유아, 아동",현금지급,월,보호대상아동(요보호아동)을 보호ㆍ양육하기를 희망하는 가정에 위탁 양육함으로써 가정적인 분위기에서 건전한 사회인으로 자랄 수 있도록 지원,https://www.bokjiro.go.kr/ssis-tbu/twataa/wlfareInfo/moveTWAT52011M.do?wlfareInfoId=WLF00000434&wlfareInfoReldBztpCd=02,1174,
제도,지자체,WLF00002682,"장애인 생활안정 추가지원(부부장애수당,중증장애인가구 월동비)",세종특별자치시,세종특별자치시,세종특별자치시 보건복지국 노인장애인과,서민금융,"청년, 중장년, 청소년, 노년, 영유아, 아동",현금지급,월,저소득장애인의 생활안정 지원,https://www.bokjiro.go.kr/ssis-tbu/twataa/wlfareInfo/moveTWAT52011M.do?wlfareInfoId=WLF00002682&wlfareInfoReldBztpCd=02,2182,
제도,지자체,WLF00004980,청소년쉼터 이용청소년 주거정착금 지원,제주특별자치도,제주특별자치도,제주특별자치도 복지가족국 아동보육청소년과,"보호·돌봄, 서민금융",청소년,현금지급,년,경제적 어려움을 겪고 있는 가정 밖 청소년의 자립을 지원하여 사회 부적응에 따른 이탈 방지 및 건강한 사회구성원으로 성장 지원,https://www.bokjiro.go.kr/ssis-tbu/twataa/wlfareInfo/moveTWAT52011M.do?wlfareInfoId=WLF00004980&wlfareInfoReldBztpCd=02,1853,
제도,지자체,WLF00003746,저소득주민 자녀 교복 및 체육복비 지원 사업,경상북도,경상북도,경상북도 경주시 시민행정국 복지정책과,"서민금융, 교육",청소년,현금지급,1회성,중고등학교 신입생 체육복구입비 지원,https://www.bokjiro.go.kr/ssis-tbu/twataa/wlfareInfo/moveTWAT52011M.do?wlfareInfoId=WLF00003746&wlfareInfoReldBztpCd=02,1339,
제도,지자체,WLF00005504,성주군 중고등학교 신입생 교복구입비 지원,경상북도,경상북도,경상북도 성주군 미래전략실,"교육, 서민금융",청소년,현금지급,1회성,성주군 교복구입비 지원 조례 제1조(목적) 이 조례는 성주군이 교육의 공공성을 강화하고 교육복지를 통한 교육도시 실현을 위해 학생들의 교복 지원에 필요한 사항을 규정함을 목적으로 한다.,https://www.bokjiro.go.kr/ssis-tbu/twataa/wlfareInfo/moveTWAT52011M.do?wlfareInfoId=WLF00005504&wlfareInfoReldBztpCd=02,900,
제도,지자체,WLF00005267,서울시교육청 수익자부담경비 지원 사업,서울특별시,서울특별시,서울특별시교육청 기획조정실 학생맞춤지원담당관,"교육, 서민금융","청소년, 아동",감면,년,저소득 가구 학생에 대한 실질적인 지원을 통해 교육비 부담 경감 및 교육기회 확대,https://www.bokjiro.go.kr/ssis-tbu/twataa/wlfareInfo/moveTWAT52011M.do?wlfareInfoId=WLF00005267&wlfareInfoReldBztpCd=02,1817,
제도,지자체,WLF00005240,서울특별시교육청 늘봄방과후학교 자유수강권 지원,서울특별시,서울특별시,서울특별시교육청 기획조정실 학생맞춤지원담당관,"교육, 서민금융","청소년, 아동",감면,년,저소득 가구 학생에 대한 실질적인 지원을 통해 교육비 부담 경감 및 교육 기회 확대,https://www.bokjiro.go.kr/ssis-tbu/twataa/wlfareInfo/moveTWAT52011M.do?wlfareInfoId=WLF00005240&wlfareInfoReldBztpCd=02,2925,
제도,지자체,WLF00003868,다자녀가구 행복더하기(지역화폐),경기도,경기도,경기도 구리시 복지문화국 가족복지과,서민금융,"청소년, 아동",현금지급,년,출산가정 및 다자녀가정에 대한 사회적우대 분위기조성과 출산ㆍ양육에 따른 경제적 부담 경감을 통한 출산율 향상 도모,https://www.bokjiro.go.kr/ssis-tbu/twataa/wlfareInfo/moveTWAT52011M.do?wlfareInfoId=WLF00003868&wlfareInfoReldBztpCd=02,2584,
제도,지자체,WLF00001552,청소년증 발급,경상북도,경상북도,경상북도 청도군 행정안전복지국 평생보장과,,청소년,실물바우처,수시,"모든 청소년들에게 해당 연령에 대한 신분 확인과 교통수단, 문화시설 등에서의 할인 혜택제공을 통해 생활의 편의 및 다양한 문화 체험 기회를 보장함으로써 청소년의 건강한 성장을 지원함",https://www.bokjiro.go.kr/ssis-tbu/twataa/wlfareInfo/moveTWAT52011M.do?wlfareInfoId=WLF00001552&wlfareInfoReldBztpCd=02,7555,
제도,지자체,WLF00001755,장애인거주시설 무연고 기초수급자 간병비 지원,제주특별자치도,제주특별자치도,제주특별자치도 제주시 복지위생국 장애인복지과,"주거, 보호·돌봄","노년, 영유아, 아동, 중장년, 청년, 청소년",기타,1회성,기초생활보장수급자 등 저소득층이 병원 입원 시 간병해 줄 보호자가 없는 경우 간병인을 지원함으로써 안심하고 진료를 받을 수 있는 환경조성,https://www.bokjiro.go.kr/ssis-tbu/twataa/wlfareInfo/moveTWAT52011M.do?wlfareInfoId=WLF00001755&wlfareInfoReldBztpCd=02,15358,
제도,지자체,WLF00001811,참전유공자 사망위로금 지원,경상북도,경상북도,경상북도 성주군 주민복지과,서민금융,"청년, 중장년, 청소년, 영유아, 아동, 노년",현금지급,1회성,국가에 공헌하고 헌신한 참전유공자에 대한 예우,https://www.bokjiro.go.kr/ssis-tbu/twataa/wlfareInfo/moveTWAT52011M.do?wlfareInfoId=WLF00001811&wlfareInfoReldBztpCd=02,801,
제도,지자체,WLF00001835,걸인구호비,경상북도,경상북도,경상북도 성주군 주민복지과,,"청소년, 청년, 중장년, 노년, 영유아, 아동",현물지급,수시,관내에서 발생하는 행려자 대한 행정조치,https://www.bokjiro.go.kr/ssis-tbu/twataa/wlfareInfo/moveTWAT52011M.do?wlfareInfoId=WLF00001835&wlfareInfoReldBztpCd=02,595,
제도,지자체,WLF00006055,달빛어린이병원 운영 지원,울산광역시,울산광역시,울산광역시 시민건강국 식의약안전과,,"아동, 영유아, 청소년",현물지급,년,"- 응급실 외 휴일(토,일,공휴일) 소아경증환자에게 외래 진료를 통해 신속한 의료서비스 제공 - 국고보조금(운영비) 지우너 기준에 미달되는 지정 의료기관에 대하여, 향후 진료시간 확대를 통해 국비 지원 기준을 충족하기 전 까지 시비를 지원하여 안정적인 운영 도모",https://www.bokjiro.go.kr/ssis-tbu/twataa/wlfareInfo/moveTWAT52011M.do?wlfareInfoId=WLF00006055&wlfareInfoReldBztpCd=02,929,
제도,지자체,WLF00005482,저소득층 자녀 안경구입비 지원,제주특별자치도,제주특별자치도,제주특별자치도 복지가족국 복지정책과,서민금융,"아동, 청소년",현금지급,1회성,◇ 저소득층 자녀 중 시력 교정이 필요한 학생에게 안경구입비 지원 ◇ 사전 시력 저하 예방 및 경제적 부담 완화,https://www.bokjiro.go.kr/ssis-tbu/twataa/wlfareInfo/moveTWAT52011M.do?wlfareInfoId=WLF00005482&wlfareInfoReldBztpCd=02,7954,
제도,지자체,WLF00005288,저소득층 학생 교육비(현장체험학습비) 지원,대전광역시,대전광역시,대전광역시교육청 기획국 교육복지안전과,,청소년,기타,분기,"- 취약 계층 및 다자녀 가정 학생들이 수학여행,수련활동 등 현장체험학습에 소외감 없이 참여할 수 있도록 수익자부담 경비 지원 및 교육복지 이념 실현 - 다자녀 가정 학생에 대한 교육비 지원으로 정부의 출산 장려 정책 부응",https://www.bokjiro.go.kr/ssis-tbu/twataa/wlfareInfo/moveTWAT52011M.do?wlfareInfoId=WLF00005288&wlfareInfoReldBztpCd=02,4457,
제도,지자체,WLF00004298,저소득가정 자녀 학습비 지원사업,경상북도,경상북도,경상북도 울릉군 주민복지과,"교육, 서민금융",청소년,현금지급,월,"저소득 취약계층 가정의 교육비 부담을 경감시키고, 자녀에게 폭넓은 교육기회를 제공하여 건전한 사회구성원으로 성장 지원을 도모하고자 함.",https://www.bokjiro.go.kr/ssis-tbu/twataa/wlfareInfo/moveTWAT52011M.do?wlfareInfoId=WLF00004298&wlfareInfoReldBztpCd=02,1659,
제도,지자체,WLF00003024,어린이날 행사지원,충청북도,충청북도,충청북도 증평군 행정복지국 행복돌봄과,,"아동, 영유아, 청소년",프로그램/서비스(서비스),1회성,어린이날 아동 문화 참여 행사,https://www.bokjiro.go.kr/ssis-tbu/twataa/wlfareInfo/moveTWAT52011M.do?wlfareInfoId=WLF00003024&wlfareInfoReldBztpCd=02,767,
제도,지자체,WLF00002489,"무연고사망자 장제비지원, 행려자 여비지원",인천광역시,인천광역시,인천광역시 중구 행정복지국 복지정책과,서민금융,"노년, 아동, 영유아, 청소년, 중장년, 청년",현금지급,수시,무연고사망자 장제비 지원 및 행려자 여비 지원,https://www.bokjiro.go.kr/ssis-tbu/twataa/wlfareInfo/moveTWAT52011M.do?wlfareInfoId=WLF00002489&wlfareInfoReldBztpCd=02,831,
제도,지자체,WLF00002029,저소득 중증장애인가구 유료방송 이용요금 지원,강원특별자치도,강원특별자치도,강원특별자치도 양양군 기획재정국 복지정책과,,"노년, 아동, 영유아, 청소년, 청년, 중장년",현물지급,월,○ 저소득 중증장애인 가구의 경제적인 부담 경감과 외부환경에 대한 다양한 정보제공 ○ 보편적 시청권 보장과 정보격차 해소 및 생활안정 도모에 기여하고자 함,https://www.bokjiro.go.kr/ssis-tbu/twataa/wlfareInfo/moveTWAT52011M.do?wlfareInfoId=WLF00002029&wlfareInfoReldBztpCd=02,1543,
제도,지자체,WLF00003105,입양가정 장려금 지원,충청북도,충청북도,충청북도 증평군 행정복지국 행복돌봄과,"서민금융, 입양·위탁","아동, 영유아, 청소년",현금지급,1회성,"태어난 가정에서 양육하기 어려운 아동의 국내 입양을 촉진하고, 요보호아동을 입양한 가정을 지원함으로써 건전한 입양문화 조성 및 입양아동의 권익과 복지증진에 기여",https://www.bokjiro.go.kr/ssis-tbu/twataa/wlfareInfo/moveTWAT52011M.do?wlfareInfoId=WLF00003105&wlfareInfoReldBztpCd=02,930,
제도,지자체,WLF00004299,저소득층 희귀난치성질환자 병원수진 교통비 지원,경상북도,경상북도,경상북도 울릉군 주민복지과,"서민금융, 신체건강","청소년, 청년, 중장년, 노년, 아동, 영유아",현금지급,수시,과도한 의료비 지출로 경제적 부담을 안고 있는 저소득층 희귀난치성(중증)질환자 가구에 관외 병원 수진시 소요되는 교통비를 지원함으로써 적기 치료로 건강증진 및 복지체감도 증대 도모,https://www.bokjiro.go.kr/ssis-tbu/twataa/wlfareInfo/moveTWAT52011M.do?wlfareInfoId=WLF00004299&wlfareInfoReldBztpCd=02,1797,
제도,지자체,WLF00003378,공설묘지주변마을지원사업,강원특별자치도,강원특별자치도,강원특별자치도 삼척시 자치행정국 사회복지과,,"영유아, 아동, 중장년, 노년, 청소년, 청년",기타,수시,"삼척시 추모공원(공설묘지, 공설장사시설)의 설치된 당해 지역사회 주민의 복지증진과 삶의 질 향상에 이바지하여 불편/위화감을 최소화하는 역할을 수행코자 함",https://www.bokjiro.go.kr/ssis-tbu/twataa/wlfareInfo/moveTWAT52011M.do?wlfareInfoId=WLF00003378&wlfareInfoReldBztpCd=02,740,
제도,지자체,WLF00001814,무연고자(부랑인)보호 관리,강원특별자치도,강원특별자치도,강원특별자치도 양양군 기획재정국 복지정책과,,"노년, 영유아, 아동, 청소년, 청년, 중장년",기타,1회성,행려자에 대한 숙박 여비를 지급하여 노숙을 방지하고 안전한 귀향을 도모하고자 함,https://www.bokjiro.go.kr/ssis-tbu/twataa/wlfareInfo/moveTWAT52011M.do?wlfareInfoId=WLF00001814&wlfareInfoReldBztpCd=02,975,
제도,지자체,WLF00003373,결식아동 급식지원,강원특별자치도,강원특별자치도,강원특별자치도 속초시 경제복지국 교육가족지원과,,"청소년, 아동, 영유아","전자바우처(바우처), 기타",월,결식아동 또는 결식이 우려되는 아동을 대상으로 아동급식 서비스를 지원하여 아동의 건전육성과 사회통합에 기여,https://www.bokjiro.go.kr/ssis-tbu/twataa/wlfareInfo/moveTWAT52011M.do?wlfareInfoId=WLF00003373&wlfareInfoReldBztpCd=02,2844,
제도,지자체,WLF00003423,가정위탁양육지원(지방이양),강원특별자치도,강원특별자치도,강원특별자치도 속초시 경제복지국 교육가족지원과,"서민금융, 입양·위탁","아동, 청소년",현금지급,월,가정위탁아동 및 소년소녀가정의 건전한 성장을 지원 보호대상아동(요보호아동)을 보호.양육하기를 희망하는 가정에 위탁 양육함으로써 가정적인 분위기에서 건전한 사회인으로 자랄 수 있도록 함,https://www.bokjiro.go.kr/ssis-tbu/twataa/wlfareInfo/moveTWAT52011M.do?wlfareInfoId=WLF00003423&wlfareInfoReldBztpCd=02,1229,
제도,지자체,WLF00000409,화천군 저소득자녀 학업안정지원,강원특별자치도,강원특별자치도,강원특별자치도 화천군 주민복지과,"서민금융, 교육",청소년,현금지급,반기,저소득주민자녀 장학금지원사업을 통해 지속적학업 유지 및 학습의욕 고취.,https://www.bokjiro.go.kr/ssis-tbu/twataa/wlfareInfo/moveTWAT52011M.do?wlfareInfoId=WLF00000409&wlfareInfoReldBztpCd=02,760,
제도,지자체,WLF00003666,가정위탁양육수당 지원,강원특별자치도,강원특별자치도,강원특별자치도 동해시 행정복지국 가족과,"서민금융, 안전·위기, 입양·위탁","영유아, 아동, 청소년",현금지급,월,요보호아동을 보호.양육하기를 희망하는 가정에 위탁 양육함으로써 가정적인 분위기에서 건전한 사회인으로 자랄 수 있도록 하기 위함,https://www.bokjiro.go.kr/ssis-tbu/twataa/wlfareInfo/moveTWAT52011M.do?wlfareInfoId=WLF00003666&wlfareInfoReldBztpCd=02,3344,
제도,지자체,WLF00003802,시각장애인생활이동지원센터 운영,강원특별자치도,강원특별자치도,강원특별자치도 화천군 주민복지과,,"청소년, 청년, 아동, 영유아, 중장년, 노년",프로그램/서비스(서비스),분기,"장애인에게 차량운행, 기타 이동서비스 제공을 통한 일상생활의 편리제공 및 사회활동 기회 확대",https://www.bokjiro.go.kr/ssis-tbu/twataa/wlfareInfo/moveTWAT52011M.do?wlfareInfoId=WLF00003802&wlfareInfoReldBztpCd=02,2164,
제도,지자체,WLF00000652,행려자 일시구호,강원특별자치도,강원특별자치도,강원특별자치도 강릉시 복지민원국 복지정책과,서민금융,"청소년, 청년, 중장년, 노년, 아동, 영유아",현금지급,1회성,행려자의 안전 귀가를 위한 귀향여비 지급,https://www.bokjiro.go.kr/ssis-tbu/twataa/wlfareInfo/moveTWAT52011M.do?wlfareInfoId=WLF00000652&wlfareInfoReldBztpCd=02,832,
제도,지자체,WLF00003717,가정위탁아동 양육보조금 지원,강원특별자치도,강원특별자치도,강원특별자치도 화천군 주민복지과,"서민금융, 안전·위기, 입양·위탁","아동, 청소년","현금지급, 지역화폐",월,"요보호 아동을 보호,양육하기를 희망하는 가정에 위탁 양육함으로써 가정적인 분위기에서 건전한 사회인으로 자랄수 있도록 함.",https://www.bokjiro.go.kr/ssis-tbu/twataa/wlfareInfo/moveTWAT52011M.do?wlfareInfoId=WLF00003717&wlfareInfoReldBztpCd=02,3566,
제도,지자체,WLF00000385,아동급식지원,강원특별자치도,강원특별자치도,강원특별자치도 화천군 주민복지과,"입양·위탁, 교육, 안전·위기","청소년, 영유아, 아동",현물지급,수시,저소득 가정의 아동들이 건강하게 자랄 수 있도록 급식지원 등을 통해 결식예방 및 영양개선,https://www.bokjiro.go.kr/ssis-tbu/twataa/wlfareInfo/moveTWAT52011M.do?wlfareInfoId=WLF00000385&wlfareInfoReldBztpCd=02,3073,
제도,지자체,WLF00003156,발달장애아동 지원사업,강원특별자치도,강원특별자치도,강원특별자치도 속초시 경제복지국 경로장애인과,,"아동, 영유아, 청소년",프로그램/서비스(서비스),월,장애아동재활치료바우처 사업에서 제외된 장애아동에게 재활치료 비용지원으로 부모의 경제적 부담 경감시키고 장애아동 기능을 향상시키고자 함,https://www.bokjiro.go.kr/ssis-tbu/twataa/wlfareInfo/moveTWAT52011M.do?wlfareInfoId=WLF00003156&wlfareInfoReldBztpCd=02,6116,
제도,지자체,WLF00004300,저소득층집수리사업,경상북도,경상북도,경상북도 울릉군 주민복지과,,"아동, 중장년, 노년, 청년, 청소년",현물지급,년,저소득 취약계층의 노후 불량주택을 개보수하여 열악한 주거환경을 개선함으로써 주거복지 증진 및 삶의 질 향상 도모,https://www.bokjiro.go.kr/ssis-tbu/twataa/wlfareInfo/moveTWAT52011M.do?wlfareInfoId=WLF00004300&wlfareInfoReldBztpCd=02,15337,
제도,지자체,WLF00006048,청소년 시내버스 무료 이용 지원 사업,강원특별자치도,강원특별자치도,강원특별자치도 속초시 도시안전국 교통과,,청소년,기타,월,청소년의 이동권 보장과 교통비 부담 완화의 필요성이 대두되는 시점에 인구 소멸 대응 및 탄소중립에 기여하고 교육·문화 활동에 참여할 수 있는 포용적인 교통 복지 체계를 구축하고자 함.,https://www.bokjiro.go.kr/ssis-tbu/twataa/wlfareInfo/moveTWAT52011M.do?wlfareInfoId=WLF00006048&wlfareInfoReldBztpCd=02,1942,
제도,지자체,WLF00006047,아이돌봄서비스 본인부담금 지원사업,대구광역시,대구광역시,대구광역시 군위군 주민복지실,서민금융,"청소년, 영유아, 아동",현금지급,월,"맞벌이가구 증가 등으로 발생하는 양육공백에 아이돌봄서비스를 제공하여 시설복육의 사각지대를 해소하고, 가족의 양육부담 경감으로 일,가정 양립을 통한 양육친화적인 사회분위기 조성",https://www.bokjiro.go.kr/ssis-tbu/twataa/wlfareInfo/moveTWAT52011M.do?wlfareInfoId=WLF00006047&wlfareInfoReldBztpCd=02,1604,
제도,지자체,WLF00006046,맘편한 산후조리비 지원,인천광역시,인천광역시,인천광역시 여성가족국 영유아정책과,"임신·출산, 서민금융, 신체건강","중장년, 영유아, 임신 · 출산, 청소년, 청년",지역화폐,1회성,'23년 인천 잠정 합계출산율 0.69명(전국 0.72명)으로 심각한 저출산 문제 극복을 위해 출산가정에 산후조리비 지원으로 산모와 신생아의 건강증진 도모 및 친출산 환경 조성,https://www.bokjiro.go.kr/ssis-tbu/twataa/wlfareInfo/moveTWAT52011M.do?wlfareInfoId=WLF00006046&wlfareInfoReldBztpCd=02,6874,
제도,지자체,WLF00006044,광주광역시 서구 아동주거빈곤해소사업,광주광역시,광주광역시,광주광역시 서구 통합돌봄국 돌봄정책과,입양·위탁,"아동, 청소년","현물지급, 프로그램/서비스(서비스)",년,□ 아동 주거빈곤 해소를 위한 지원을 함으로써 아동의 주거권 보장 □ 아동이 쾌적하고 안정된 삶을 영위하는데 이바지하기 위함,https://www.bokjiro.go.kr/ssis-tbu/twataa/wlfareInfo/moveTWAT52011M.do?wlfareInfoId=WLF00006044&wlfareInfoReldBztpCd=02,1357,
제도,지자체,WLF00006043,장애인 보장구 수리비 지원사업,강원특별자치도,강원특별자치도,강원특별자치도 삼척시 자치행정국 사회복지과,,"청년, 청소년, 노년, 중장년, 아동, 영유아",기타,1회성,"장애인이 사용하는 보장구의 수리비용을 지원하여 지속적이고 안정적으로 보장구를 사용할 수 있는 환경을 조성함으로써, 장애인의 기본적인 이동권을 확보하고 그에 따른 사회활동 참여를 증진하고자 함",https://www.bokjiro.go.kr/ssis-tbu/twataa/wlfareInfo/moveTWAT52011M.do?wlfareInfoId=WLF00006043&wlfareInfoReldBztpCd=02,662,
제도,지자체,WLF00006035,긴급복지지원사업,충청북도,충청북도,충청북도 음성군 문화복지국 복지정책과,서민금융,"청년, 청소년, 중장년, 노년",현금지급,월,"질병,실직,재해등 위기상황에 처해 생계어려움을 겪고 있는 가구에 일시적으로 신속하게 지원하여 위기에서 벗어날수 있도록 돕기 위함.",https://www.bokjiro.go.kr/ssis-tbu/twataa/wlfareInfo/moveTWAT52011M.do?wlfareInfoId=WLF00006035&wlfareInfoReldBztpCd=02,2109,
제도,지자체,WLF00006031,학교 밖 청소년 검정고시 합격축하금 지원,부산광역시,부산광역시,부산광역시 동구 경제복지국 가족복지과,서민금융,청소년,지역화폐,1회성,교육복지의 사각지대에 있는 학교 밖 청소년에게 검정고시 합격축하금을 지원하여 학업 의욕 고취 및 학업 성취도 증진 등 교육지원,https://www.bokjiro.go.kr/ssis-tbu/twataa/wlfareInfo/moveTWAT52011M.do?wlfareInfoId=WLF00006031&wlfareInfoReldBztpCd=02,2199,
제도,지자체,WLF00005732,찾아가는 임신출산관리서비스,경기도,경기도,경기도 안산시 상록수보건소,,"청년, 청소년","기타, 프로그램/서비스(서비스)",1회성,"찾아가는 임신출산관리서비스(1:1 방문 임산부 요가, 명상 등) 제공을 통한 임산부의 건강증진을 도모한다.",https://www.bokjiro.go.kr/ssis-tbu/twataa/wlfareInfo/moveTWAT52011M.do?wlfareInfoId=WLF00005732&wlfareInfoReldBztpCd=02,1012,
제도,지자체,WLF00005557,현장체험학습비 지원,충청북도,충청북도,충청북도교육청 기획국 체육건강안전과,교육,청소년,기타,년,학교 교육과정 내 다양한 교외체험학습 경비 지원으로 교육의 균등기회 실현과 교육격차 해소 및 학부모 부담 경감,https://www.bokjiro.go.kr/ssis-tbu/twataa/wlfareInfo/moveTWAT52011M.do?wlfareInfoId=WLF00005557&wlfareInfoReldBztpCd=02,721,
제도,지자체,WLF00005468,임산부 교통비 지원사업,인천광역시,인천광역시,인천광역시 여성가족국 영유아정책과,"임신·출산, 서민금융","임신 · 출산, 청소년, 청년, 중장년",지역화폐,1회성,교통약자인 임산부에게 교통비 지원을 통해 건강한 출산 도모 및 경제적 부담 완화,https://www.bokjiro.go.kr/ssis-tbu/twataa/wlfareInfo/moveTWAT52011M.do?wlfareInfoId=WLF00005468&wlfareInfoReldBztpCd=02,8595,
제도,지자체,WLF00005462,강원특별자치도 학교 밖 청소년 자기개발 지원 '꿈드림 수당',강원특별자치도,강원특별자치도,강원특별자치도 복지보건국 여성청소년가족과,서민금융,청소년,"기타, 지역화폐",월,1. 학교 밖 청소년의 학업복귀 및 사회진입을 도와 건강한 사회구성원으로 성장할 수 있도록 예방적 지원 서비스 강화 2. 청소년들이 제안한 정책을 도 정책에 반영함으로써 청소년 정책의 주도성 강화,https://www.bokjiro.go.kr/ssis-tbu/twataa/wlfareInfo/moveTWAT52011M.do?wlfareInfoId=WLF00005462&wlfareInfoReldBztpCd=02,1824,
제도,지자체,WLF00005347,인천광역시 다른 시도 소재 중.고교 등 신입생 교복비 지원,인천광역시,인천광역시,인천광역시 기획조정실 교육협력담당관,"서민금융, 교육",청소년,현금지급,년,교육의 공공성 강화 및 교육복지 실현,https://www.bokjiro.go.kr/ssis-tbu/twataa/wlfareInfo/moveTWAT52011M.do?wlfareInfoId=WLF00005347&wlfareInfoReldBztpCd=02,2027,
제도,지자체,WLF00005344,가정위탁아동 예체능활동비 지원,인천광역시,인천광역시,인천광역시 여성가족국 아동정책과,"서민금융, 입양·위탁","청소년, 아동, 영유아",현금지급,월,가정위탁아동 예체능활동비 지원을 통한 가정위탁아동의 건강한 신체 및 정서 함양 지원,https://www.bokjiro.go.kr/ssis-tbu/twataa/wlfareInfo/moveTWAT52011M.do?wlfareInfoId=WLF00005344&wlfareInfoReldBztpCd=02,912,
