category,welfareType,servId,servNm,region,agency,department,intrsThemaArray,lifeArray,srvPvsnNm,sprtCycNm,servDgst,servDtlLink,inqNum,contact
제도,지자체,WLF00002027,양양어린이날 행사운영 보조,강원특별자치도,강원특별자치도,강원특별자치도 양양군 교육체육과,,"청소년, 아동, 영유아","기타, 프로그램/서비스(서비스)",1회성,- 양양어린이날 행사 운영보조,https://www.bokjiro.go.kr/ssis-tbu/twataa/wlfareInfo/moveTWAT52011M.do?wlfareInfoId=WLF00002027&wlfareInfoReldBztpCd=02,758,
제도,지자체,WLF00004410,가정위탁 아동 양육수당 지원,부산광역시,부산광역시,부산광역시 여성가족국 아동청소년과,"서민금융, 안전·위기, 입양·위탁","청소년, 영유아, 아동",현금지급,월,가정위탁 보호아동 양육수당 지원 jmi,https://www.bokjiro.go.kr/ssis-tbu/twataa/wlfareInfo/moveTWAT52011M.do?wlfareInfoId=WLF00004410&wlfareInfoReldBztpCd=02,3579,
제도,지자체,WLF00000731,보호종료아동 자립정착금 지원,부산광역시,부산광역시,부산광역시 여성가족국 아동청소년과,"서민금융, 보호·돌봄, 입양·위탁",청소년,현금지급,반기,가정위탁아동 등 보호대상아동이 퇴소 후 사회에서 자립하는데 필요한 생활용품 등의 구입비용 지원으로 자립활성화,https://www.bokjiro.go.kr/ssis-tbu/twataa/wlfareInfo/moveTWAT52011M.do?wlfareInfoId=WLF00000731&wlfareInfoReldBztpCd=02,2171,
제도,지자체,WLF00002458,저소득 부자가족 주거지원 사업,부산광역시,부산광역시,부산광역시 여성가족국 여성가족과,,"중장년, 청년, 청소년",기타,년,"한국토지주택공사 매입임대주택을 활용, 부자가족의 주거안정 도모",https://www.bokjiro.go.kr/ssis-tbu/twataa/wlfareInfo/moveTWAT52011M.do?wlfareInfoId=WLF00002458&wlfareInfoReldBztpCd=02,1535,
제도,지자체,WLF00002790,공동생활가정(그룹홈)사업 지원,부산광역시,부산광역시,부산광역시 여성가족국 아동청소년과,"보호·돌봄, 주거, 교육, 안전·위기","청소년, 영유아, 아동",시설입소,분기,보호를 필요로 하는 아동을 가족적 환경에서 성장하도록 지도함으로써 정성적 안정 도모 및 이웃과의 교류 등 사회적응 능력 배양,https://www.bokjiro.go.kr/ssis-tbu/twataa/wlfareInfo/moveTWAT52011M.do?wlfareInfoId=WLF00002790&wlfareInfoReldBztpCd=02,4411,
제도,지자체,WLF00000006,한부모가족자녀 교통비 등 지원,부산광역시,부산광역시,부산광역시 여성가족국 여성가족과,"서민금융, 교육","청소년, 아동",현금지급,분기,저소득 한부모가족 자녀에 대한 교통비 지원으로 경제적 부담 완화 및 지원,https://www.bokjiro.go.kr/ssis-tbu/twataa/wlfareInfo/moveTWAT52011M.do?wlfareInfoId=WLF00000006&wlfareInfoReldBztpCd=02,6706,
제도,지자체,WLF00001764,의사상자 예우지원,경기도,경기도,경기도 의왕시 복지문화국 복지정책과,,"노년, 아동, 청소년, 중장년, 청년",기타,년,의로운 행위를 한 사람의 숭고한 뜻을 기리고 귀감으로 삼아 사회정의를 실현하기 위하여 의로운 시민과 그 가족 또는 유족 등에 대한 예우 및 지원을 목적으로 한다.,https://www.bokjiro.go.kr/ssis-tbu/twataa/wlfareInfo/moveTWAT52011M.do?wlfareInfoId=WLF00001764&wlfareInfoReldBztpCd=02,1127,
제도,지자체,WLF00001848,사회복지신문 구독 지원,강원특별자치도,강원특별자치도,강원특별자치도 복지보건국 복지정책과,,"청년, 중장년, 청소년, 영유아, 아동, 노년",기타,년,"사회복지시설·기관, 사회복지분야 우수 자원봉사자 등에게 사회복지관련 시책 등 각종 정보를 제공함으로써 자원봉사 활성화에 기여하고자 함",https://www.bokjiro.go.kr/ssis-tbu/twataa/wlfareInfo/moveTWAT52011M.do?wlfareInfoId=WLF00001848&wlfareInfoReldBztpCd=02,944,
제도,지자체,WLF00002895,화장장려금 지원,충청북도,충청북도,충청북도 음성군 문화복지국 가족행복과,"서민금융, 안전·위기","아동, 영유아, 노년, 중장년, 청소년, 청년",현금지급,1회성,"묘지 증가에 따른 국토의 훼손을 방지하고, 화장문화를 확산시키기 위해 화장에 소요되는 비용 일부를 지원",https://www.bokjiro.go.kr/ssis-tbu/twataa/wlfareInfo/moveTWAT52011M.do?wlfareInfoId=WLF00002895&wlfareInfoReldBztpCd=02,4684,
제도,지자체,WLF00002764,다자녀가정 입학축하금,서울특별시,서울특별시,서울특별시 동대문구 주민복지국 보육여성과,"서민금융, 교육","아동, 청소년",현금지급,1회성,다자녀 입학축하금 지급으로 출산을 장려하는 사회분위기 조성,https://www.bokjiro.go.kr/ssis-tbu/twataa/wlfareInfo/moveTWAT52011M.do?wlfareInfoId=WLF00002764&wlfareInfoReldBztpCd=02,2720,
제도,지자체,WLF00000974,교통약자이동지원센터 운영,경기도,경기도,경기도 과천시 건설도시국 교통과,,"청소년, 중장년, 청년, 노년, 영유아, 아동",기타,수시,"이동에 상당한 제약이 있는 장애인에게 차량운행을 통해 직장 출퇴근, 외출보조 및 병원이용 보조 등 각종 이동서비스 지원으로 장애인의 사회 활동기회 확대",https://www.bokjiro.go.kr/ssis-tbu/twataa/wlfareInfo/moveTWAT52011M.do?wlfareInfoId=WLF00000974&wlfareInfoReldBztpCd=02,1522,
제도,지자체,WLF00000260,효행수당 지원,충청북도,충청북도,충청북도 음성군 문화복지국 가족행복과,서민금융,"청년, 중장년, 청소년, 노년, 아동, 영유아",현금지급,월,효 문화 발전 및 효 장려를 위해 4대가구 동거가족에게 효행수당을 지급,https://www.bokjiro.go.kr/ssis-tbu/twataa/wlfareInfo/moveTWAT52011M.do?wlfareInfoId=WLF00000260&wlfareInfoReldBztpCd=02,874,
제도,지자체,WLF00001490,부랑인 및 행려자 지원,경기도,경기도,경기도 의왕시 복지문화국 복지정책과,서민금융,"노년, 중장년, 청년, 청소년","현금지급, 시설입소, 현물지급",1회성,"노숙인에게 노숙인 시설을 이용하게 하거나, 치료를 요하는 경우 보건의료기관에 진료를 받도록 하여 노숙인을 안전하게 구호",https://www.bokjiro.go.kr/ssis-tbu/twataa/wlfareInfo/moveTWAT52011M.do?wlfareInfoId=WLF00001490&wlfareInfoReldBztpCd=02,684,
제도,지자체,WLF00001566,저소득층건강보험료지원,경기도,경기도,경기도 의왕시 복지문화국 복지정책과,신체건강,"영유아, 아동, 노년, 청소년, 중장년, 청년",기타,월,"건강보험료 납부에 어려움을 겪는 저소득 가구(장애인,한부모,만성질환)에 보험료지원",https://www.bokjiro.go.kr/ssis-tbu/twataa/wlfareInfo/moveTWAT52011M.do?wlfareInfoId=WLF00001566&wlfareInfoReldBztpCd=02,1112,
제도,지자체,WLF00000796,부랑인 노숙인 관리지원,서울특별시,서울특별시,서울특별시 서초구 주민생활국 사회복지과,,"노년, 영유아, 아동, 청년, 중장년, 청소년",기타,1회성,- 부랑인 및 노숙인에 대한 생활안정 및 자립기반 조성으로 부랑인 귀향 및 조속한 사회복귀 지원,https://www.bokjiro.go.kr/ssis-tbu/twataa/wlfareInfo/moveTWAT52011M.do?wlfareInfoId=WLF00000796&wlfareInfoReldBztpCd=02,763,
제도,지자체,WLF00001491,"국민기초생활 보장지원(월동난방비, 대학생전공교재비, 이사비용, 쓰레기봉투비, 진단서 발급비용)",경기도,경기도,경기도 과천시 경제복지국 복지정책과,서민금융,"청소년, 청년, 중장년, 노년, 영유아, 아동",현금지급,수시,국민기초생활 보장지원을 통한 수급자의 안정적 생활 지원,https://www.bokjiro.go.kr/ssis-tbu/twataa/wlfareInfo/moveTWAT52011M.do?wlfareInfoId=WLF00001491&wlfareInfoReldBztpCd=02,10805,
제도,지자체,WLF00001518,사회보장적 수혜금,광주광역시,광주광역시,광주광역시 복지건강국 돌봄정책과,서민금융,"아동, 영유아, 노년, 청소년, 중장년, 청년","현금지급, 기타",1회성,"- 선정기준 선정기준, 지원기간, 지원 수준등 구체적인 사항은 시장이 정함 공동모금회 지원과 연계하여 중복되지 않도록 지급 - 지원내용 사회복지시설 기초생활보장법에 따른 차상위 계층 등",https://www.bokjiro.go.kr/ssis-tbu/twataa/wlfareInfo/moveTWAT52011M.do?wlfareInfoId=WLF00001518&wlfareInfoReldBztpCd=02,3343,
제도,지자체,WLF00001927,중증장애인 상해보험,제주특별자치도,제주특별자치도,제주특별자치도 제주시 복지위생국 장애인복지과,서민금융,"청소년, 청년, 중장년, 노년",현금지급,1회성,중증장애인이 일상생활에서 겪을 수 있는 안전사고로 인한 경제적 부담을 경감하기 위하여 단체 상해보험에 가입함으로써 생활 안전도모,https://www.bokjiro.go.kr/ssis-tbu/twataa/wlfareInfo/moveTWAT52011M.do?wlfareInfoId=WLF00001927&wlfareInfoReldBztpCd=02,2489,
제도,지자체,WLF00002112,저소득주민 국민건강보험료 지원,서울특별시,서울특별시,서울특별시 은평구 돌봄복지국 통합돌봄과,서민금융,"노년, 영유아, 아동, 청년, 중장년, 청소년",현금지급,월,"생활에 어려움을 겪고 있으나, 수급권자에 해당되지 않는 저소득 주민에게 건강보험료를 지원함으로써 건강증진과 사회복지 향상을 목적으로 함.",https://www.bokjiro.go.kr/ssis-tbu/twataa/wlfareInfo/moveTWAT52011M.do?wlfareInfoId=WLF00002112&wlfareInfoReldBztpCd=02,1472,
제도,지자체,WLF00000977,장애인 휠체어 수리 지원,서울특별시,서울특별시,서울특별시 중구 생활복지친화국 사회복지과,,"중장년, 청년, 청소년, 노년, 아동, 영유아",기타,년,장애인 이동권 보장,https://www.bokjiro.go.kr/ssis-tbu/twataa/wlfareInfo/moveTWAT52011M.do?wlfareInfoId=WLF00000977&wlfareInfoReldBztpCd=02,717,
제도,지자체,WLF00002053,저소득 한부모가족 자립지원(조손가정아동용돈),제주특별자치도,제주특별자치도,제주특별자치도 서귀포시 복지위생국 여성가족과,서민금융,"아동, 청소년",현금지급,월,조손가정 아동에 대하여 일상생활에 필요한 최소한의 문화활동비(용돈) 보조로 아동의 삶의 질 향상,https://www.bokjiro.go.kr/ssis-tbu/twataa/wlfareInfo/moveTWAT52011M.do?wlfareInfoId=WLF00002053&wlfareInfoReldBztpCd=02,1961,
제도,지자체,WLF00002052,저소득 한부모가족 자립지원(조손가정수당),제주특별자치도,제주특별자치도,제주특별자치도 서귀포시 복지위생국 여성가족과,서민금융,"청소년, 노년, 아동, 영유아",현금지급,월,조손가정 실질적인 최저생활보장과 아동의 건강한 성장도모,https://www.bokjiro.go.kr/ssis-tbu/twataa/wlfareInfo/moveTWAT52011M.do?wlfareInfoId=WLF00002052&wlfareInfoReldBztpCd=02,1475,
제도,지자체,WLF00002495,저소득 한부모가족 자립지원(대학신입생등록금),제주특별자치도,제주특별자치도,제주특별자치도 서귀포시 복지위생국 여성가족과,"서민금융, 교육","청년, 청소년",현금지급,1회성,저소득 한부모가족 자녀의 대학 입학에 따른 경제적 부담을 덜어주기 위하여 입학지원금 지원,https://www.bokjiro.go.kr/ssis-tbu/twataa/wlfareInfo/moveTWAT52011M.do?wlfareInfoId=WLF00002495&wlfareInfoReldBztpCd=02,13981,
제도,지자체,WLF00001725,저소득 한부모가족 자립지원(자녀학습비),제주특별자치도,제주특별자치도,제주특별자치도 서귀포시 복지위생국 여성가족과,서민금융,청소년,현금지급,월,"저소득 한부모가족 중,고 자녀를 위한 자녀의 학습비를 지원하여 학습능력 향상 및 능력을 갖춘 사회인으로의 성장도모",https://www.bokjiro.go.kr/ssis-tbu/twataa/wlfareInfo/moveTWAT52011M.do?wlfareInfoId=WLF00001725&wlfareInfoReldBztpCd=02,1425,
제도,지자체,WLF00001726,저소득 한부모가족 자립지원(자립정착금),제주특별자치도,제주특별자치도,제주특별자치도 서귀포시 복지위생국 여성가족과,서민금융,"청소년, 중장년, 청년, 노년, 영유아, 아동",현금지급,1회성,한부모가족 보장에서 중지되는 세대에 대하여 자립정착금 지원으로 생활안정 및 자립기반 마련,https://www.bokjiro.go.kr/ssis-tbu/twataa/wlfareInfo/moveTWAT52011M.do?wlfareInfoId=WLF00001726&wlfareInfoReldBztpCd=02,1645,
제도,지자체,WLF00001724,저소득 한부모가족 자립지원(월동준비금),제주특별자치도,제주특별자치도,제주특별자치도 서귀포시 복지위생국 여성가족과,서민금융,"아동, 영유아, 노년, 중장년, 청년, 청소년",현금지급,년,저소득 한부모가족의 겨울맞이 경제적 부담을 덜어주기 위하여 월동준비금 지원,https://www.bokjiro.go.kr/ssis-tbu/twataa/wlfareInfo/moveTWAT52011M.do?wlfareInfoId=WLF00001724&wlfareInfoReldBztpCd=02,1941,
제도,지자체,WLF00001727,저소득 한부모가족 자립지원(직업훈련비),제주특별자치도,제주특별자치도,제주특별자치도 서귀포시 복지위생국 여성가족과,서민금융,"노년, 청년, 중장년, 청소년",현금지급,수시,"한부모가족 세대주의 취,창업 지원을 통하여 자활 기회마련",https://www.bokjiro.go.kr/ssis-tbu/twataa/wlfareInfo/moveTWAT52011M.do?wlfareInfoId=WLF00001727&wlfareInfoReldBztpCd=02,2040,
제도,지자체,WLF00001647,한부모가족복지시설 운영 지원(한부모가족복지시설 퇴소자 자립정착금),제주특별자치도,제주특별자치도,제주특별자치도 서귀포시 복지위생국 여성가족과,서민금융,"영유아, 아동, 노년, 청소년, 중장년, 청년",현금지급,1회성,보호시설 퇴소 후 자립이 어려운 대상자에게 자립정착금 지원으로 자립기반 마련,https://www.bokjiro.go.kr/ssis-tbu/twataa/wlfareInfo/moveTWAT52011M.do?wlfareInfoId=WLF00001647&wlfareInfoReldBztpCd=02,1159,
제도,지자체,WLF00002621,한부모가족 지원 활성화,부산광역시,부산광역시,부산광역시 남구 복지교육국 가족친화과,서민금융,"노년, 영유아, 아동, 청소년, 청년, 중장년",현금지급,1회성,한부모가족 명절자립격려금 및 하계휴가비 지원을 통해 한부모가족의 사회적 소속감 및 가족친화력 제고,https://www.bokjiro.go.kr/ssis-tbu/twataa/wlfareInfo/moveTWAT52011M.do?wlfareInfoId=WLF00002621&wlfareInfoReldBztpCd=02,3355,
제도,지자체,WLF00002534,남구 의로운 구민 등에 대한 예우 및 지원,부산광역시,부산광역시,부산광역시 남구 복지교육국 복지정책과,서민금융,"영유아, 아동, 노년, 청소년, 중장년, 청년",현금지급,1회성,의로운 행동으로 타인의 위해(危害)를 구하다가 신체상부상 등을 입은 사람과 그 유족 또는 가족에 대하여 그 희생과 피해의 정도 등에 알맞은 예우와 지원을 함으로써 의로운 구민의 숭고한 뜻을 기리고 사회정의를 실현하는데 이바지하는 것을 목적으로 한다.,https://www.bokjiro.go.kr/ssis-tbu/twataa/wlfareInfo/moveTWAT52011M.do?wlfareInfoId=WLF00002534&wlfareInfoReldBztpCd=02,1074,
제도,지자체,WLF00001199,저소득 장애인 지원(인공달팽이관 수술자 재활치료비),경기도,경기도,경기도 부천시 복지위생국 장애인복지과,,"아동, 영유아, 청소년",기타,분기,저소득 청각장애인의 인공달팽이관 재활치료비 지원으로 장애인가구의 의료비 부담 경감 및 청력회복으로 원활한 사회활동 도모를 목적으로 함,https://www.bokjiro.go.kr/ssis-tbu/twataa/wlfareInfo/moveTWAT52011M.do?wlfareInfoId=WLF00001199&wlfareInfoReldBztpCd=02,796,
제도,지자체,WLF00002109,서울시 저소득 중증장애인 전세주택 제공사업,서울특별시,서울특별시,서울특별시 은평구 주민복지국 장애인복지과,,"노년, 영유아, 아동, 청년, 중장년, 청소년",현금대여(융자),1회성,저소득 중증장애인이 월세 부담에서 벗어나 전세주택에 입주할 수 있도록 최장 6년간 무상으로 전세보증금을 지원하여 주거환경 개선 및 지역사회 자립기반 마련에 도움을 주고자 함,https://www.bokjiro.go.kr/ssis-tbu/twataa/wlfareInfo/moveTWAT52011M.do?wlfareInfoId=WLF00002109&wlfareInfoReldBztpCd=02,1832,
제도,지자체,WLF00002841,이재민 구호 물품 지원,부산광역시,부산광역시,부산광역시 영도구 주민복지국 복지정책과,,"청소년, 청년, 아동, 영유아, 중장년, 노년",현물지급,1회성,자연재해발생시 이재민에 대한 구호를 실시함으로써 이재민의 보호와 생활안정에 기여함,https://www.bokjiro.go.kr/ssis-tbu/twataa/wlfareInfo/moveTWAT52011M.do?wlfareInfoId=WLF00002841&wlfareInfoReldBztpCd=02,1776,
제도,지자체,WLF00000927,국민건강보험료 지원,부산광역시,부산광역시,부산광역시 강서구 복지환경국 생활지원과,,"청년, 중장년, 청소년, 노년, 아동, 영유아",기타,월,일정 기준 이하의 국민건강보험료를 납부하는 세대에 대한 보험료 지원을 통한 경제적 부담 경감,https://www.bokjiro.go.kr/ssis-tbu/twataa/wlfareInfo/moveTWAT52011M.do?wlfareInfoId=WLF00000927&wlfareInfoReldBztpCd=02,2332,
제도,지자체,WLF00002463,강서구장학회 장학기금 지원,부산광역시,부산광역시,부산광역시 강서구 복지교육국 평생교육과,"서민금융, 교육",청소년,현금지급,1회성,"저소득가정, 학업성 우수·모범학생, 특기생에 장학금 지급을 통한 학업증진 도모",https://www.bokjiro.go.kr/ssis-tbu/twataa/wlfareInfo/moveTWAT52011M.do?wlfareInfoId=WLF00002463&wlfareInfoReldBztpCd=02,2220,
제도,지자체,WLF00002249,장애인가정 출산지원금 지급,서울특별시,서울특별시,서울특별시 중구 생활복지친화국 사회복지과,"서민금융, 임신·출산","청소년, 임신 · 출산, 중장년, 청년, 노년, 아동, 영유아",현금지급,1회성,장애인가구에 출산비용을 지원함으로써 경제적 부담을 경감하고 출산 친화적 문화조성을 통한 삶의 질 개선에 기여하는 것을 목적으로 함.,https://www.bokjiro.go.kr/ssis-tbu/twataa/wlfareInfo/moveTWAT52011M.do?wlfareInfoId=WLF00002249&wlfareInfoReldBztpCd=02,1142,
제도,지자체,WLF00005476,제천시 청소년 역량강화 교육비 지원 사업,충청북도,충청북도,충청북도 제천시 문화복지국 여성가족과,,청소년,실물바우처,월,"법정저소득계층(기초생활수급자, 차상위계층, 저소득한부모가정) 청소년에게 역량강화 교육비를 바우처로 지원하여 진로개발 지원 강화",https://www.bokjiro.go.kr/ssis-tbu/twataa/wlfareInfo/moveTWAT52011M.do?wlfareInfoId=WLF00005476&wlfareInfoReldBztpCd=02,1261,
제도,지자체,WLF00004830,제천시 청소년꿈모아바우처 지원,충청북도,충청북도,충청북도 제천시 문화복지국 여성가족과,,청소년,실물바우처,년,"자녀 양육에 따른 청소년 가구의 경제적 부담을 경감하고 건강한 성장 발달을 도모하여 청소년의 기본적 권리와 복지 증진에 이바지함을 목적으로 합니다. <지원금액> 1. 9세부터 12세까지의 청소년: 연 5만원 2. 13세부터 15세까지의 청소년: 연 7만원 3. 16세부터 18세까지의 청소년: 연 10만원 <지원분야> 1. 진로개발 및 취미활동: 독서실, 직업기술분야 학원, 취미활동을 위한 예능분야(음악, 미술, 무용) 학원, 서점 2. 문화시설: 영화관, 공연장 3. 체육시설 4. 생활지원: 이·미용실, 문구점, 안경점",https://www.bokjiro.go.kr/ssis-tbu/twataa/wlfareInfo/moveTWAT52011M.do?wlfareInfoId=WLF00004830&wlfareInfoReldBztpCd=02,1274,
제도,지자체,WLF00000290,아동급식지원,충청북도,충청북도,충청북도 증평군 행정복지국 행복돌봄과,"서민금융, 안전·위기","아동, 청소년","전자바우처(바우처), 현금지급",월,경제적 빈곤 또는 가족기능결손으로 결식하거나 결식할 우려가 있는 아동에게 식사를 제공함으로써 아동의 건전육성 도모,https://www.bokjiro.go.kr/ssis-tbu/twataa/wlfareInfo/moveTWAT52011M.do?wlfareInfoId=WLF00000290&wlfareInfoReldBztpCd=02,2661,
제도,지자체,WLF00000513,거동불편 중증장애인 구급차 이용지원,충청북도,충청북도,충청북도 옥천군 행정복지국 주민복지과,"서민금융, 신체건강","영유아, 아동, 노년, 청소년, 중장년, 청년",현금지급,수시,거동 불편한 재가 중증장애인의 이동보장권을 확보하여 사각지대에 놓인 대상자의 의료 및 복지 혜택 증진,https://www.bokjiro.go.kr/ssis-tbu/twataa/wlfareInfo/moveTWAT52011M.do?wlfareInfoId=WLF00000513&wlfareInfoReldBztpCd=02,1391,
제도,지자체,WLF00003000,저소득층 국민건강보험료 지원,충청북도,충청북도,충청북도 단양군 행정복지국 주민복지과,,"청년, 청소년, 중장년, 노년, 영유아, 아동",기타,월,"차상위계층(월 20,000원 미만) 및 소액납부자(월 5,000원미만) 국민건강보험료 지원",https://www.bokjiro.go.kr/ssis-tbu/twataa/wlfareInfo/moveTWAT52011M.do?wlfareInfoId=WLF00003000&wlfareInfoReldBztpCd=02,1116,
제도,지자체,WLF00000484,저소득 한부모가족 건강보험료 지원,충청북도,충청북도,충청북도 제천시 문화복지국 여성가족과,서민금융,"영유아, 아동, 노년, 중장년, 청년, 청소년",감면,월,＊ 생활에 어려움을 겪고 있는 저소득 한부모가족에게 건강보험료 및 노인장기요양보험료를 지원함으로써 시민의 건강증진과 사회복지 향상에 기여함을 목적으로 합니다.,https://www.bokjiro.go.kr/ssis-tbu/twataa/wlfareInfo/moveTWAT52011M.do?wlfareInfoId=WLF00000484&wlfareInfoReldBztpCd=02,6431,
제도,지자체,WLF00002834,행려자 관리,울산광역시,울산광역시,울산광역시 남구 복지교육국 복지지원과,,"아동, 영유아, 중장년, 노년, 청년, 청소년",기타,1회성,사회복지 수혜 사각지역에 있는 행려자의 기본적인 삶의 질 향상을 목적으로 함,https://www.bokjiro.go.kr/ssis-tbu/twataa/wlfareInfo/moveTWAT52011M.do?wlfareInfoId=WLF00002834&wlfareInfoReldBztpCd=02,4446,
제도,지자체,WLF00005795,학교우유급식(바우처) 지원사업,전북특별자치도,전북특별자치도,전북특별자치도 군산시 농업기술센터 동물정책과,,"청소년, 아동",전자바우처(바우처),월,세 자녀 이상 가정에 우유바우처 카드 지원을 통해 경제적 부담 완화 및 유제품 소비기반 확대로 낙농산업의 안정적 발전 도모,https://www.bokjiro.go.kr/ssis-tbu/twataa/wlfareInfo/moveTWAT52011M.do?wlfareInfoId=WLF00005795&wlfareInfoReldBztpCd=02,1239,
제도,지자체,WLF00004757,부안군여성청소년생리용품지원사업,전북특별자치도,전북특별자치도,전북특별자치도 부안군 행정복지국 교육청소년과,"입양·위탁, 서민금융",청소년,지역화폐,분기,청소년복지지원법 제5조제3항에 따라 여성청소년의 건강증진과 복지향상 기여,https://www.bokjiro.go.kr/ssis-tbu/twataa/wlfareInfo/moveTWAT52011M.do?wlfareInfoId=WLF00004757&wlfareInfoReldBztpCd=02,2322,
제도,지자체,WLF00002615,장애인활동지원 구비추가 사업,서울특별시,서울특별시,서울특별시 마포구 복지동행국 장애인복지과,,"아동, 노년, 청소년, 중장년, 청년",전자바우처(바우처),월,신체적·정신적 장애 등의 사유로 혼자서 일상생활과 사회생활을 영위하기 어려운 최중증장애인에게 활동지원급여 구 추가사업을 통해 자립생활을 지원하여 생활의 안정을 제공하고 장애인의 삶의 질을 높이고자 함,https://www.bokjiro.go.kr/ssis-tbu/twataa/wlfareInfo/moveTWAT52011M.do?wlfareInfoId=WLF00002615&wlfareInfoReldBztpCd=02,4686,
제도,지자체,WLF00000489,보호대상아동 생활안정지원,전북특별자치도,전북특별자치도,전북특별자치도 완주군 행정복지국 교육아동복지과,입양·위탁,"청소년, 아동",기타,분기,보호대상아동이 위탁 가정 내에서 건전한 사회인으로 성장하도록 생활 안정 지원,https://www.bokjiro.go.kr/ssis-tbu/twataa/wlfareInfo/moveTWAT52011M.do?wlfareInfoId=WLF00000489&wlfareInfoReldBztpCd=02,1339,
제도,지자체,WLF00003685,결혼이민자가족 모국방문사업(고향나들이사업),전북특별자치도,전북특별자치도,전북특별자치도 완주군 행정복지국 교육아동복지과,서민금융,"영유아, 아동, 중장년, 노년, 청소년, 청년",현금지급,1회성,결혼이민자에게 모국방문 기회 제공 및 가족 구성원 상호간의 이해 증진,https://www.bokjiro.go.kr/ssis-tbu/twataa/wlfareInfo/moveTWAT52011M.do?wlfareInfoId=WLF00003685&wlfareInfoReldBztpCd=02,1846,
제도,지자체,WLF00003644,상당구 장애인복지 증진(중증장애인 세상나들이),충청북도,충청북도,충청북도 청주시 상당구 주민복지과,,"중장년, 노년, 아동, 영유아, 청년, 청소년",기타,1회성,중증장애인 세상나들이)중증장애인 및 가족(보호자)에게 나들이를 통해 다양한 경험을 제공,https://www.bokjiro.go.kr/ssis-tbu/twataa/wlfareInfo/moveTWAT52011M.do?wlfareInfoId=WLF00003644&wlfareInfoReldBztpCd=02,1041,
