category,welfareType,servId,servNm,region,agency,department,intrsThemaArray,lifeArray,srvPvsnNm,sprtCycNm,servDgst,servDtlLink,inqNum,contact
제도,지자체,WLF00000810,장애인보장구수리센터운영,경기도,경기도,경기도 시흥시 복지국 장애인복지과,,"청소년, 청년, 중장년, 아동, 영유아, 노년",프로그램/서비스(서비스),수시,소외계층인 저소득장애인을 대상으로 보장구 수리에 따른 경제적 부담 완화,https://www.bokjiro.go.kr/ssis-tbu/twataa/wlfareInfo/moveTWAT52011M.do?wlfareInfoId=WLF00000810&wlfareInfoReldBztpCd=02,695,
제도,지자체,WLF00002375,장애인 이미용 서비스 지원 사업,전라남도,전라남도,전라남도 화순군 사회복지과,,"중장년, 청년, 청소년, 노년, 영유아, 아동",자원봉사,분기,거동이 불편한 중증장애인의 가정을 방문하여 이미용 서비스를 지원함으로써 생활편의 및 복지증진 도모,https://www.bokjiro.go.kr/ssis-tbu/twataa/wlfareInfo/moveTWAT52011M.do?wlfareInfoId=WLF00002375&wlfareInfoReldBztpCd=02,2189,
제도,지자체,WLF00001372,장애인특별운송사업,경기도,경기도,경기도 시흥시 복지국 장애인복지과,,"영유아, 아동, 노년, 중장년, 청년, 청소년",프로그램/서비스(서비스),수시,거동이 불편한 장애인을 위한 이동수단 제공,https://www.bokjiro.go.kr/ssis-tbu/twataa/wlfareInfo/moveTWAT52011M.do?wlfareInfoId=WLF00001372&wlfareInfoReldBztpCd=02,756,
제도,지자체,WLF00001243,취약계층 복지증진(무연고 사망자 및 노숙인 지원),경기도,경기도,경기도 김포시 복지국 생활보장과,서민금융,"청소년, 중장년, 청년, 아동, 영유아, 노년",현금지급,1회성,"노숙인(부랑인 및 행려자)에게 귀향여비 지급 또는 공공구호기관 연계, 관내 사망자 중 연고를 알 수 없거나, 연고가 없을 경우 및 연고자가 시체인도를 거부하는 경우 사망자의 장례절차를 지원하고자 함.",https://www.bokjiro.go.kr/ssis-tbu/twataa/wlfareInfo/moveTWAT52011M.do?wlfareInfoId=WLF00001243&wlfareInfoReldBztpCd=02,2221,
제도,지자체,WLF00002602,저소득 한부모가족 명절위문금 지원,서울특별시,서울특별시,서울특별시 서대문구 복지문화체육국 가족정책과,서민금융,"청년, 중장년, 청소년, 노년, 영유아, 아동",현금지급,년,"저소득 한부모가족의 최저생활 수준 충족을 위해 법정급여 외 명절(설, 추석)위문금 지급",https://www.bokjiro.go.kr/ssis-tbu/twataa/wlfareInfo/moveTWAT52011M.do?wlfareInfoId=WLF00002602&wlfareInfoReldBztpCd=02,9664,
제도,지자체,WLF00005949,특목고 기회균등전형대상자 교육비 지원,제주특별자치도,제주특별자치도,제주특별자치도교육청 교육국 정서회복과,"서민금융, 교육",청소년,감면,년,"- 교육비 지원을 통해 기회균등전형대상자 학부모의 경제적 부담을 줄이고, 학생들이 학업을 지속할 수 있도록 보장 - 사회적 배려 대상자들에게 공정한 교육 기회를 보장하여 교육 불평등 해소하고 모든 학생이 균등한 환경에서 학업에 전념할 수 있도록 지원하여 실질적 교육복지 실현",https://www.bokjiro.go.kr/ssis-tbu/twataa/wlfareInfo/moveTWAT52011M.do?wlfareInfoId=WLF00005949&wlfareInfoReldBztpCd=02,1191,
제도,지자체,WLF00005635,저소득층 학생 교육정보화(PC) 지원,대구광역시,대구광역시,대구광역시교육청 행정국 교육복지과,교육,"청소년, 아동",기타,년,"사이버 가정학습, 이러닝 시스템의 활용여건 제공으로 저소득층 자녀들에게 균등한 교육기회 마련, 정보접근 환경 개선 및 사회경제적 불평등 해소",https://www.bokjiro.go.kr/ssis-tbu/twataa/wlfareInfo/moveTWAT52011M.do?wlfareInfoId=WLF00005635&wlfareInfoReldBztpCd=02,3335,
제도,지자체,WLF00005275,현장체험학습비 지원,세종특별자치시,세종특별자치시,세종특별자치시교육청 교육행정국 교육복지과,"교육, 서민금융",청소년,감면,1회성,교육복지 실현 및 학부모 교육비 부담 경감,https://www.bokjiro.go.kr/ssis-tbu/twataa/wlfareInfo/moveTWAT52011M.do?wlfareInfoId=WLF00005275&wlfareInfoReldBztpCd=02,923,
제도,지자체,WLF00005266,중고 신입생 체육복비 지원,세종특별자치시,세종특별자치시,세종특별자치시교육청 교육행정국 교육복지과,"서민금융, 교육",청소년,현금지급,1회성,학생체육복비 지원으로 보편적 교육복지 실현을 통한 명품교육 도시 실현,https://www.bokjiro.go.kr/ssis-tbu/twataa/wlfareInfo/moveTWAT52011M.do?wlfareInfoId=WLF00005266&wlfareInfoReldBztpCd=02,1894,
제도,지자체,WLF00005256,서울특별시교육청 대안교육기관 급식비 지원 사업,서울특별시,서울특별시,서울특별시교육청 기획조정실 학생맞춤지원담당관,,"아동, 청소년",기타,분기,- 차별없는 보편적 교육복지의 실현으로 교육의 공공성 강화 - 학교 밖 청소년의 건강한 학습권 보장,https://www.bokjiro.go.kr/ssis-tbu/twataa/wlfareInfo/moveTWAT52011M.do?wlfareInfoId=WLF00005256&wlfareInfoReldBztpCd=02,1226,
제도,지자체,WLF00005072,탈모 치료비 지원,충청남도,충청남도,충청남도 보령시 보건소 건강증진과,"서민금융, 신체건강","아동, 청소년, 청년",현금지급,월,"탈모로 정신적, 육체적 고통을 받고 있는 대상자(49세 이하)에게 일상생활에 자신감을 부여하고 건강한 사회 구성원으로서 역할을 수행할 수 있도록 지원하는 사업입니다.",https://www.bokjiro.go.kr/ssis-tbu/twataa/wlfareInfo/moveTWAT52011M.do?wlfareInfoId=WLF00005072&wlfareInfoReldBztpCd=02,8891,
제도,지자체,WLF00004784,다둥이 가족 캠핑카라반 대여비 지원 사업,대구광역시,대구광역시,대구광역시 달성군 기획예산실,서민금융,"청소년, 아동, 영유아",현금지급,년,가족 여행이 어려운 다둥이 가정에 캠핑카라반 이용요금을 지원하여 경제적 부담을 절감하고 가족 상호간 유대 및 삶의 질 향상을 도모,https://www.bokjiro.go.kr/ssis-tbu/twataa/wlfareInfo/moveTWAT52011M.do?wlfareInfoId=WLF00004784&wlfareInfoReldBztpCd=02,3089,
제도,지자체,WLF00000194,나주시 중고교 신입생 교복 지원 사업,전라남도,전라남도,전라남도 나주시 미래전략산업국 교육지원과,교육,청소년,현물지급,1회성,"교육의 공공성 강화 및 보편적 교육복지 실현, 학부모의 교육비 부담 경감",https://www.bokjiro.go.kr/ssis-tbu/twataa/wlfareInfo/moveTWAT52011M.do?wlfareInfoId=WLF00000194&wlfareInfoReldBztpCd=02,969,
제도,지자체,WLF00001044,저소득 한부모가족 안경 구입비 지원,경기도,경기도,경기도 오산시 복지교육국 가족보육과,서민금융,"청소년, 아동",현금지급,년,저소득 한부모가족의 건강한 생활을 위한 안경구입에 대한 경제적 지원,https://www.bokjiro.go.kr/ssis-tbu/twataa/wlfareInfo/moveTWAT52011M.do?wlfareInfoId=WLF00001044&wlfareInfoReldBztpCd=02,4276,
제도,지자체,WLF00002359,한부모가족 중고교 입학자녀 교복비,경상북도,경상북도,경상북도 상주시 행정복지국 아이여성행복과,"서민금융, 교육",청소년,현금지급,년,저소득 한부모가족 중고교 입학자녀에게 교복비 지원,https://www.bokjiro.go.kr/ssis-tbu/twataa/wlfareInfo/moveTWAT52011M.do?wlfareInfoId=WLF00002359&wlfareInfoReldBztpCd=02,2407,
제도,지자체,WLF00001024,저소득 한부모가정 초·중·고등학생 체험학습비 지원,경기도,경기도,경기도 오산시 복지교육국 가족보육과,"서민금융, 교육",청소년,현금지급,년,저소득한부모가정의 교육비 부담을 경감,https://www.bokjiro.go.kr/ssis-tbu/twataa/wlfareInfo/moveTWAT52011M.do?wlfareInfoId=WLF00001024&wlfareInfoReldBztpCd=02,1059,
제도,지자체,WLF00003788,저소득 한부모가정 아동발달 지원계좌 지원,경기도,경기도,경기도 오산시 복지교육국 가족보육과,서민금융,"청소년, 아동",현금지급,월,저소득 한부모가족 자녀의 자립을 위한 경제적 지원,https://www.bokjiro.go.kr/ssis-tbu/twataa/wlfareInfo/moveTWAT52011M.do?wlfareInfoId=WLF00003788&wlfareInfoReldBztpCd=02,2812,
제도,지자체,WLF00004412,장애인활동지원(시비추가지원),부산광역시,부산광역시,부산광역시 사회복지국 장애인복지과,,"청소년, 청년, 아동, 중장년",전자바우처(바우처),월,"국고보조 장애인활동지원대상자 중 독거, 사지마비와상 등 활동지원 급여부족(서비스 시간)에 따른 추가활동 서비스 제공으로 중증장애인의 자립생활 및 사회참여 증진도모",https://www.bokjiro.go.kr/ssis-tbu/twataa/wlfareInfo/moveTWAT52011M.do?wlfareInfoId=WLF00004412&wlfareInfoReldBztpCd=02,5623,
제도,지자체,WLF00002032,장애인활동지원 시 추가지원,경상남도,경상남도,경상남도 창원시 복지여성보건국 노인장애인과,,"청년, 중장년, 청소년, 아동, 노년",전자바우처(바우처),월,활동지원서비스 추가 지원을 통한 중증장애인의 자립생활 지원 및 가족의 부담 경감,https://www.bokjiro.go.kr/ssis-tbu/twataa/wlfareInfo/moveTWAT52011M.do?wlfareInfoId=WLF00002032&wlfareInfoReldBztpCd=02,3045,
제도,지자체,WLF00000952,장애인과 함께하는 1일 체험행사,부산광역시,부산광역시,부산광역시 수영구 복지환경국 가족행복과,,"노년, 청소년, 청년, 중장년","기타, 프로그램/서비스(서비스)",년,문화활동에 제약을 받는 장애인에게 1일 문화활동을 할 수 있도록 지원하여 장애인의 사회활동 참여 기회 확대 도모,https://www.bokjiro.go.kr/ssis-tbu/twataa/wlfareInfo/moveTWAT52011M.do?wlfareInfoId=WLF00000952&wlfareInfoReldBztpCd=02,876,
제도,지자체,WLF00000110,저소득 한부모세대 생활안정,경상남도,경상남도,경상남도 창원시 복지여성보건국 여성가족과,서민금융,"청소년, 청년","현금지급, 프로그램/서비스(서비스)",수시,저소득 한부모세대 생활안정,https://www.bokjiro.go.kr/ssis-tbu/twataa/wlfareInfo/moveTWAT52011M.do?wlfareInfoId=WLF00000110&wlfareInfoReldBztpCd=02,1652,
제도,지자체,WLF00000981,저소득자 및 보훈단체 지원(국가유공자 및 유족격려),서울특별시,서울특별시,서울특별시 용산구 생활지원국 복지정책과,서민금융,"청소년, 중장년, 청년, 아동, 영유아, 노년",현금지급,1회성,"국가보훈대상자에게 설, 추석, 보훈의 달에 위문금 지급",https://www.bokjiro.go.kr/ssis-tbu/twataa/wlfareInfo/moveTWAT52011M.do?wlfareInfoId=WLF00000981&wlfareInfoReldBztpCd=02,815,
제도,지자체,WLF00003578,중증장애인 부모세대자녀의 학원교육비 지원,경기도,경기도,경기도 남양주시 복지국 장애인복지과,"서민금융, 교육","청소년, 아동",현금지급,월,부모의 장애로 인하여 교육여건이 어려운 중증장애인 부모세대 자녀에게 사설학원비 지원하여 교육기회 보장,https://www.bokjiro.go.kr/ssis-tbu/twataa/wlfareInfo/moveTWAT52011M.do?wlfareInfoId=WLF00003578&wlfareInfoReldBztpCd=02,2978,
제도,지자체,WLF00001294,장애인운전면허취득지원,경기도,경기도,경기도 하남시 복지문화국 노인장애인복지과,서민금융,"중장년, 청년, 청소년",현금지급,수시,신체적 장애로 인해 이동이 불편한 장애인의 이동권을 확보하고 저소득 장애인의 사회활동 참여 유도,https://www.bokjiro.go.kr/ssis-tbu/twataa/wlfareInfo/moveTWAT52011M.do?wlfareInfoId=WLF00001294&wlfareInfoReldBztpCd=02,1761,
제도,지자체,WLF00002828,장애인 명절위문품 지원,서울특별시,서울특별시,서울특별시 강북구 복지생활국 어르신·장애인과,,"청소년, 청년, 노년, 중장년, 아동, 영유아",실물바우처,년,지역에서 소외된 장애인들에게 명절위문품을 지급하여 명절준비에 대한 경제적 부담을 덜고자 함,https://www.bokjiro.go.kr/ssis-tbu/twataa/wlfareInfo/moveTWAT52011M.do?wlfareInfoId=WLF00002828&wlfareInfoReldBztpCd=02,1218,
제도,지자체,WLF00002547,저소득층 맞춤형지원 사업,울산광역시,울산광역시,울산광역시 동구 복지문화국 복지지원과,서민금융,"노년, 아동, 영유아, 청소년, 중장년, 청년",현금지급,1회성,"동구주민으로서 질병, 실직, 노령, 장애, 이혼 등으로 생활에 어려움을 겪고 있는 저소득층에 대하여 기본적인 생계유지를 위해 맞춤형으로 지원함.",https://www.bokjiro.go.kr/ssis-tbu/twataa/wlfareInfo/moveTWAT52011M.do?wlfareInfoId=WLF00002547&wlfareInfoReldBztpCd=02,13052,
제도,지자체,WLF00001000,장애인무료급식소 운영,서울특별시,서울특별시,서울특별시 성동구 복지국 어르신장애인복지과,안전·위기,"노년, 아동, 청년, 중장년, 청소년",기타,년,장애인무료급식소 운영- 지역 저소득 장애인의 양질의 점심제공으로 건강증진과 장애인단체의 사회적 기능 활성화 결식우려 저소득장애인발굴- 거동불편 장애인의 건강증진 및 사회참여 기회확대 도모,https://www.bokjiro.go.kr/ssis-tbu/twataa/wlfareInfo/moveTWAT52011M.do?wlfareInfoId=WLF00001000&wlfareInfoReldBztpCd=02,903,
제도,지자체,WLF00003789,저소득 한부모가정 지원 (연료비),경기도,경기도,경기도 오산시 복지교육국 가족보육과,서민금융,"영유아, 아동, 중장년, 노년, 청소년, 청년",현금지급,년,저소득 한부모가족 및 국민기초수급자 한부모가족 1가구당 연1회 연료비 지원,https://www.bokjiro.go.kr/ssis-tbu/twataa/wlfareInfo/moveTWAT52011M.do?wlfareInfoId=WLF00003789&wlfareInfoReldBztpCd=02,1856,
제도,지자체,WLF00005933,여주시 산후조리비 지원사업,경기도,경기도,경기도 여주시 보건소 건강증진과,"서민금융, 임신·출산","중장년, 청소년, 임신 · 출산, 청년",현금지급,수시,출산가정의 경제적 부담 경감 및 아이 낳기 좋은 출산 환경 조성,https://www.bokjiro.go.kr/ssis-tbu/twataa/wlfareInfo/moveTWAT52011M.do?wlfareInfoId=WLF00005933&wlfareInfoReldBztpCd=02,3252,
제도,지자체,WLF00005930,제1형 당뇨병 학생 의료비 지원,인천광역시,인천광역시,인천광역시교육청 학교교육국 체육건강교육과,"서민금융, 교육, 신체건강","청소년, 아동, 영유아",현금지급,년,제1형 당뇨병은 완치가 어려워 주기적인 혈당 체크 및 인슐린 주입 등 평생 치료가 필요한 질병으로 제1형 당뇨 학생 의료비 지원을 통해 가정내 경제적 부담 완화 및 안정적ㅇ인 학교생활을 도모하기 위함,https://www.bokjiro.go.kr/ssis-tbu/twataa/wlfareInfo/moveTWAT52011M.do?wlfareInfoId=WLF00005930&wlfareInfoReldBztpCd=02,1496,
제도,지자체,WLF00005921,파주시 저소득 어린이 청소년 교통비 지원,경기도,경기도,경기도 파주시 도로교통국 버스정책과,서민금융,청소년,지역화폐,분기,"파주시 내 저소득 가정의 어린이 청소년을 대상으로 교통비를 지원함으로써, 저소득 어린이 청소년의 대중교통 이용편의를 증진하기 위한 사업입니다.",https://www.bokjiro.go.kr/ssis-tbu/twataa/wlfareInfo/moveTWAT52011M.do?wlfareInfoId=WLF00005921&wlfareInfoReldBztpCd=02,2689,
제도,지자체,WLF00005555,다자녀가정 양육장려금 지원,경상북도,경상북도,경상북도 고령군 인구정책실,서민금융,"청소년, 영유아, 아동",지역화폐,월,다자녀가정의 양육 부담 완화와 안정된 정주요건 및 출산ㆍ양육에 유리한 환경 조성,https://www.bokjiro.go.kr/ssis-tbu/twataa/wlfareInfo/moveTWAT52011M.do?wlfareInfoId=WLF00005555&wlfareInfoReldBztpCd=02,1743,
제도,지자체,WLF00005198,서울특별시교육청 대안교육기관 입학준비금 지원 사업,서울특별시,서울특별시,서울특별시교육청 기획조정실 학생맞춤지원담당관,서민금융,"아동, 청소년",지역화폐,년,"서울시교육청 등록 대안교육기관 및 서울 거주 타 시도 대안교육기관 신규 입학생에게 입학 준비물 구입비를 지원하여, 교육복지를 실현하고 보호자의 교육비 부담을 경감하고자 함",https://www.bokjiro.go.kr/ssis-tbu/twataa/wlfareInfo/moveTWAT52011M.do?wlfareInfoId=WLF00005198&wlfareInfoReldBztpCd=02,1115,
제도,지자체,WLF00004894,서민자녀 꿈플러스사업,경상남도,경상남도,경상남도 거창군 행정국 인구교육과,서민금융,"아동, 청소년",현금지급,월,서민자녀들의 교육격차 해소 및 동등한 교육기회 제공,https://www.bokjiro.go.kr/ssis-tbu/twataa/wlfareInfo/moveTWAT52011M.do?wlfareInfoId=WLF00004894&wlfareInfoReldBztpCd=02,892,
제도,지자체,WLF00001363,광명시 초중고등학생 입학 축하금 지원,경기도,경기도,경기도 광명시 평생학습사업소 교육청소년과,"서민금융, 교육",청소년,지역화폐,1회성,교육비 부담 경감으로 교육의 공공성 강화 및 보편적 교육복지 실현,https://www.bokjiro.go.kr/ssis-tbu/twataa/wlfareInfo/moveTWAT52011M.do?wlfareInfoId=WLF00001363&wlfareInfoReldBztpCd=02,3690,
제도,지자체,WLF00001868,고등학생 교복 구입비 지원,충청남도,충청남도,충청남도 공주시 교육복지국 교육체육과,교육,청소년,현물지급,년,교육의 공공성 강화와 학부모의 교육비 경감 및 보편적 교육복지 확대,https://www.bokjiro.go.kr/ssis-tbu/twataa/wlfareInfo/moveTWAT52011M.do?wlfareInfoId=WLF00001868&wlfareInfoReldBztpCd=02,781,
제도,지자체,WLF00003627,산모신생아건강관리사예외지원 확대실시사업,충청북도,충청북도,충청북도 제천시 보건소 건강관리과,,"청소년, 청년",전자바우처(바우처),1회성,산모신생아 건강증진 및 출산가정의 경제적 부담경감(아이낳기 좋은 환경조성) 대상자 가정에서 방문산후도우미 서비스를 이용함으로써 신생아 집단감염 차단 출산장려 정책 확대로 저출산 극복과 사회적 일자리 창출,https://www.bokjiro.go.kr/ssis-tbu/twataa/wlfareInfo/moveTWAT52011M.do?wlfareInfoId=WLF00003627&wlfareInfoReldBztpCd=02,13604,
제도,지자체,WLF00003010,한부모가족 난방비 지원,충청북도,충청북도,충청북도 양성평등가족정책관,서민금융,"청년, 청소년, 중장년",현금지급,수시,한부모가족의 난방비 지원으로 경제적 부담 해소 및 월동기 생활안정 도모,https://www.bokjiro.go.kr/ssis-tbu/twataa/wlfareInfo/moveTWAT52011M.do?wlfareInfoId=WLF00003010&wlfareInfoReldBztpCd=02,19150,
제도,지자체,WLF00003088,"중증장애인세대위문(설,추석)",경상남도,경상남도,경상남도 창원시 복지여성보건국 노인장애인과,서민금융,"청년, 청소년, 노년, 중장년, 아동, 영유아",현금지급,반기,저소득주민의 생활안정 지원,https://www.bokjiro.go.kr/ssis-tbu/twataa/wlfareInfo/moveTWAT52011M.do?wlfareInfoId=WLF00003088&wlfareInfoReldBztpCd=02,1042,
제도,지자체,WLF00003706,재해구호,경기도,경기도,경기도 화성시 시민복지국 복지정책과,,"아동, 영유아, 노년, 중장년, 청소년, 청년",기타,1회성,이재민 구호,https://www.bokjiro.go.kr/ssis-tbu/twataa/wlfareInfo/moveTWAT52011M.do?wlfareInfoId=WLF00003706&wlfareInfoReldBztpCd=02,855,
제도,지자체,WLF00000501,장애인활동지원 시 추가,경상남도,경상남도,경상남도 거제시 복지국 노인장애인과,,"아동, 영유아, 노년, 중장년, 청년, 청소년",전자바우처(바우처),월,장애인활동지원사업(보건복지부) 및 장애인도우미지원사업(경상남도) 대상자(독거 및 준독거) 중 3개월 이상 서비스 시간을 모두 활용하고도 시간이 부족한 대상자로 시추가 산정기준에 해당하는 자에게 지원,https://www.bokjiro.go.kr/ssis-tbu/twataa/wlfareInfo/moveTWAT52011M.do?wlfareInfoId=WLF00000501&wlfareInfoReldBztpCd=02,1098,
제도,지자체,WLF00000928,무연고사망자 장의비 지원,부산광역시,부산광역시,부산광역시 강서구 복지환경국 생활지원과,서민금융,"영유아, 아동, 노년, 청소년, 중장년, 청년",현금지급,1회성,무연고사망자 장의비 지원,https://www.bokjiro.go.kr/ssis-tbu/twataa/wlfareInfo/moveTWAT52011M.do?wlfareInfoId=WLF00000928&wlfareInfoReldBztpCd=02,696,
제도,지자체,WLF00002159,저소득주민 명절 위문 (기초수급자),서울특별시,서울특별시,서울특별시 성동구 복지국 기초복지과,서민금융,"노년, 영유아, 아동, 청소년, 중장년, 청년",현금지급,1회성,민족 고유의 명절을 맞이하여 기초생활보장수급자 세대에게 명절위문금을 전달하여 훈훈한 명절을 보낼 수 있도록 지원하고자 함,https://www.bokjiro.go.kr/ssis-tbu/twataa/wlfareInfo/moveTWAT52011M.do?wlfareInfoId=WLF00002159&wlfareInfoReldBztpCd=02,1520,
제도,지자체,WLF00005915,한부모가족 소망드림통장 지원사업,부산광역시,부산광역시,부산광역시 수영구 복지환경국 가족행복과,서민금융,청소년,현금지급,월,"한부모가족에게 자립희망의 소망드림통장 사업을 추진하여 아동의 자활 및 가구 전체의 자립을 지원, 건강한 지역사회구성원으로서 성장할 수 있도록 지원하고자 함",https://www.bokjiro.go.kr/ssis-tbu/twataa/wlfareInfo/moveTWAT52011M.do?wlfareInfoId=WLF00005915&wlfareInfoReldBztpCd=02,3994,
제도,지자체,WLF00005903,산후조리비용 지원사업,인천광역시,인천광역시,인천광역시 동구 보건소 건강증진과,"임신·출산, 서민금융","임신 · 출산, 청소년, 청년, 중장년",현금지급,1회성,❍ 인구소멸 대응 및 저출산 극복을 위한 제도적 지원 - 지속적으로 인구 및 출생아 수의 감소가 이어지고 있어 정주여건을 개선하고 지역의 활력을 도모하기 위해 인구 소멸 대응의 일환으로 출산 산모에 일정비용을 지원하여 산모와 아기의 신체적·정신적 빠른 회복을 위함,https://www.bokjiro.go.kr/ssis-tbu/twataa/wlfareInfo/moveTWAT52011M.do?wlfareInfoId=WLF00005903&wlfareInfoReldBztpCd=02,2331,
제도,지자체,WLF00005896,다자녀가정 양육바우처 지원,경상남도,경상남도,경상남도 거제시 복지국 가족정책과,,청소년,실물바우처,월,다자녀 가구의 자녀 양육에 따른 경제적 부담 완화로 출산 장려,https://www.bokjiro.go.kr/ssis-tbu/twataa/wlfareInfo/moveTWAT52011M.do?wlfareInfoId=WLF00005896&wlfareInfoReldBztpCd=02,1500,
제도,지자체,WLF00005590,청소년 학습코칭 및 온라인서비스 제공,경기도,경기도,경기도 평생교육국 평생교육과,,청소년,프로그램/서비스(서비스),기타,도내 교육 사각지대에 있는 청소년에게 고른 교육기회 제공으로 지역․계층간 교육격차 해소 및 청소년의 자기주도적 학습 기반 마련,https://www.bokjiro.go.kr/ssis-tbu/twataa/wlfareInfo/moveTWAT52011M.do?wlfareInfoId=WLF00005590&wlfareInfoReldBztpCd=02,774,
제도,지자체,WLF00005556,졸업앨범비 지원,충청북도,충청북도,충청북도교육청 행정국 재정복지과,"서민금융, 교육","아동, 청소년",감면,년,"저소득층 수급 자격 학생, 다자녀 가구 학생 등 졸업앨범비 지원으로 학부모 교육비 부담 경감 및 수요자 중심 교육복지 실현",https://www.bokjiro.go.kr/ssis-tbu/twataa/wlfareInfo/moveTWAT52011M.do?wlfareInfoId=WLF00005556&wlfareInfoReldBztpCd=02,2435,
제도,지자체,WLF00005551,저소득가정 아동 예체능 수강료 지원,인천광역시,인천광역시,인천광역시 동구 복지경제국 복지정책과,서민금융,"아동, 청소년",현금지급,월,경제적 어려움이 있는 가정 자녀에게 예체능 수강료를 지원함으로써 아이들이 보다 나은 미래를 펼칠 수 있는 계기를 마련하고자 함,https://www.bokjiro.go.kr/ssis-tbu/twataa/wlfareInfo/moveTWAT52011M.do?wlfareInfoId=WLF00005551&wlfareInfoReldBztpCd=02,1168,
제도,지자체,WLF00005279,희귀난치병학생 의료비 지원 사업,서울특별시,서울특별시,서울특별시교육청 서울특별시교육청보건안전진흥원 보건급식부 보건지원과,"서민금융, 신체건강","청소년, 아동",현금지급,년,서울시 관내 학교의 난치병 학생에 대한 치료비 지원을 통해 치료기회 확대 및 난치병 학생의 건강권과 복지 증진에 기여,https://www.bokjiro.go.kr/ssis-tbu/twataa/wlfareInfo/moveTWAT52011M.do?wlfareInfoId=WLF00005279&wlfareInfoReldBztpCd=02,1352,
제도,지자체,WLF00005083,무안군 초‧중‧고등학생 입학 축하금 지원사업,전라남도,전라남도,전라남도 무안군 자치행정과,"서민금융, 교육",청소년,지역화폐,1회성,학교 입학생이 있는 모든 가정의 교육비 부담을 덜어주고 입학을 축하하는 의미로 입학 축하금을 지원하여 학부모들의 교육비 부담을 경감하고 교육의 공공성 강화와 교육복지 증진을 위함,https://www.bokjiro.go.kr/ssis-tbu/twataa/wlfareInfo/moveTWAT52011M.do?wlfareInfoId=WLF00005083&wlfareInfoReldBztpCd=02,1535,
